{"$schema":"https://json-schema.org/draft/2020-12/schema","title":"Reported organization ZIP evidence status","type":"object","required":["schema_version","dataset_id","selected_release_id","manifest_sha256","current_pointer","ordinary_response_record_rows","zip_member_lists_exposed","network_requests","production_pointer_changes","plan57_executed"],"properties":{"schema_version":{"const":"reported-organization-zip-evidence-status@1.0.0"},"dataset_id":{"const":"reported-organization-zip-evidence-status"},"selected_release_id":{"const":"broad-organization-zip-evidence-20260923-002630301Z-9cdbdcd319f2"},"manifest_sha256":{"const":"ee5896c32daf5b50a8b1ac44717ccd4a3005b91d1ca65dfc869c04490d441a7e"},"current_pointer":{"type":"null"},"ordinary_response_record_rows":{"const":0},"zip_member_lists_exposed":{"const":false},"network_requests":{"const":0},"production_pointer_changes":{"const":false},"plan57_executed":{"const":false}},"additionalProperties":false}
