{"schema_version":"reported-organization-zip-evidence-status@1.0.0","dataset_id":"reported-organization-zip-evidence-status","selected_release_id":"broad-organization-zip-evidence-20260923-002630301Z-9cdbdcd319f2","manifest_sha256":"ee5896c32daf5b50a8b1ac44717ccd4a3005b91d1ca65dfc869c04490d441a7e","current_pointer":null,"ordinary_response_record_rows":0,"zip_member_lists_exposed":false,"network_requests":0,"production_pointer_changes":false,"plan57_executed":false}
